"No.","Time","Source","Destination","Protocol","Length","Info"
"1","0.000000","Siemens_bd:bc:46","SiemensNumer_35:d8:bc","PNIO","60","RTC1, ID:0x8000, Len:  40, Cycle:20480 (Valid,Primary,Ok,Run)"
"2","0.010435","Siemens_bd:bc:46","Siemens_23:ae:b5","PNIO","60","RTC1, ID:0x8000, Len:  40, Cycle:20736 (Valid,Primary,Ok,Run)"
"3","0.030359","Siemens_bd:bc:46","Siemens_16:18:cf","PNIO","60","RTC1, ID:0x8000, Len:  40, Cycle:20864 (Valid,Primary,Ok,Run)"
"4","0.040484","SiemensNumer_35:d8:bc","Siemens_bd:bc:46","PNIO","60","RTC1, ID:0x8001, Len:  40, Cycle:20480 (Valid,Primary,Ok,Run)"
"5","0.040505","Siemens_16:18:cf","Siemens_bd:bc:46","PNIO","60","RTC1, ID:0x8003, Len:  40, Cycle:16576 (Valid,Primary,Ok,Run)"
"6","0.040635","192.168.150.119","192.168.150.19","TCP","1514","48040  >  15416 [ACK] Seq=1 Ack=1 Win=32507 Len=1460"
"7","0.040758","192.168.150.119","192.168.150.19","TCP","1514","48040  >  15416 [ACK] Seq=1461 Ack=1 Win=32507 Len=1460"
"8","0.040781","192.168.150.119","192.168.150.19","TCP","1514","48040  >  15416 [ACK] Seq=2921 Ack=1 Win=32507 Len=1460"
"9","0.040862","192.168.150.19","192.168.150.119","TCP","60","15416  >  48040 [ACK] Seq=1 Ack=2921 Win=1026 Len=0"
"10","0.040882","192.168.150.119","192.168.150.19","TCP","910","48040  >  15416 [PSH, ACK] Seq=4381 Ack=1 Win=32507 Len=856"
"11","0.041032","192.168.150.119","192.168.150.19","TCP","1514","48040  >  15417 [ACK] Seq=1 Ack=1 Win=32768 Len=1460"
"12","0.041136","192.168.150.119","192.168.150.19","TCP","1514","48040  >  15417 [ACK] Seq=1461 Ack=1 Win=32768 Len=1460"
"13","0.041156","192.168.150.119","192.168.150.19","TCP","1514","48040  >  15417 [ACK] Seq=2921 Ack=1 Win=32768 Len=1460"
"14","0.041237","192.168.150.119","192.168.150.19","TCP","910","48040  >  15417 [PSH, ACK] Seq=4381 Ack=1 Win=32768 Len=856"
"15","0.051356","192.168.150.19","192.168.150.119","TCP","60","15416  >  48040 [ACK] Seq=1 Ack=5237 Win=1026 Len=0"
"16","0.051453","192.168.150.119","192.168.150.23","TCP","1514","48040  >  4649 [ACK] Seq=1 Ack=1 Win=32768 Len=1460"
"17","0.051573","192.168.150.119","192.168.150.23","TCP","1514","48040  >  4649 [ACK] Seq=1461 Ack=1 Win=32768 Len=1460"
"18","0.051573","192.168.150.23","192.168.150.119","TCP","60","4649  >  48040 [ACK] Seq=1 Ack=2921 Win=1026 Len=0"
"19","0.051598","192.168.150.19","192.168.150.119","TCP","60","15417  >  48040 [ACK] Seq=1 Ack=2921 Win=1026 Len=0"
"20","0.051713","192.168.150.119","192.168.150.23","TCP","1514","48040  >  4649 [ACK] Seq=2921 Ack=1 Win=32768 Len=1460"
"21","0.051765","192.168.150.119","192.168.150.23","TCP","910","48040  >  4649 [PSH, ACK] Seq=4381 Ack=1 Win=32768 Len=856"
"22","0.051816","192.168.150.23","192.168.150.119","TCP","60","4649  >  48040 [ACK] Seq=1 Ack=5237 Win=1026 Len=0"
"23","0.051877","192.168.150.119","192.168.150.23","TCP","1514","48040  >  4650 [ACK] Seq=1 Ack=1 Win=32450 Len=1460"
"24","0.052019","192.168.150.119","192.168.150.23","TCP","1514","48040  >  4650 [ACK] Seq=1461 Ack=1 Win=32450 Len=1460"
"25","0.062148","192.168.150.19","192.168.150.119","TCP","60","15417  >  48040 [ACK] Seq=1 Ack=5237 Win=1026 Len=0"
"26","0.062148","192.168.150.23","192.168.150.119","TCP","60","4650  >  48040 [ACK] Seq=1 Ack=2921 Win=1026 Len=0"
"27","0.062250","192.168.150.119","192.168.150.23","TCP","1514","48040  >  4650 [ACK] Seq=2921 Ack=1 Win=32450 Len=1460"
"28","0.062352","192.168.150.119","192.168.150.23","TCP","910","48040  >  4650 [PSH, ACK] Seq=4381 Ack=1 Win=32450 Len=856"
"29","0.072438","192.168.150.23","192.168.150.119","TCP","60","4650  >  48040 [ACK] Seq=1 Ack=5237 Win=1026 Len=0"
"30","0.072438","Siemens_23:ae:b5","Siemens_bd:bc:46","PNIO","60","RTC1, ID:0x8002, Len:  40, Cycle:61696 (Valid,Primary,Ok,Run)"
"31","0.072517","192.168.150.19","192.168.150.119","TCP","160","15417  >  48040 [PSH, ACK] Seq=1 Ack=5237 Win=1026 Len=106"
"32","0.082655","192.168.150.19","192.168.150.119","TCP","160","15416  >  48040 [PSH, ACK] Seq=1 Ack=5237 Win=1026 Len=106"
"33","0.102889","MoxaTechnolo_09:ed:fc","Broadcast","RARP","60","Who is 00:01:05:1b:9f:91? Tell 00:90:e8:09:ed:fc"
"34","0.102889","Siemens_bd:bc:46","SiemensNumer_35:d8:bc","PNIO","60","RTC1, ID:0x8000, Len:  40, Cycle:24576 (Valid,Primary,Ok,Run)"
"35","0.102915","Siemens_bd:bc:46","Siemens_23:ae:b5","PNIO","60","RTC1, ID:0x8000, Len:  40, Cycle:24832 (Valid,Primary,Ok,Run)"
"36","0.102994","Siemens_bd:bc:46","Siemens_16:18:cf","PNIO","60","RTC1, ID:0x8000, Len:  40, Cycle:24960 (Valid,Primary,Ok,Run)"
"37","0.123223","192.168.150.23","192.168.150.119","TCP","160","4649  >  48040 [PSH, ACK] Seq=1 Ack=5237 Win=1026 Len=106"
"38","0.123223","192.168.150.119","192.168.150.23","TCP","66","48040  >  4649 [ACK] Seq=5237 Ack=107 Win=32715 Len=0 SLE=1 SRE=107"
"39","0.123324","SiemensNumer_35:d8:bc","Siemens_bd:bc:46","PNIO","60","RTC1, ID:0x8001, Len:  40, Cycle:24576 (Valid,Primary,Ok,Run)"
"40","0.123324","192.168.150.119","192.168.150.19","TCP","60","48040  >  15416 [ACK] Seq=5237 Ack=107 Win=32454 Len=0"
"41","0.133445","192.168.150.23","192.168.150.119","TCP","160","4650  >  48040 [PSH, ACK] Seq=1 Ack=5237 Win=1026 Len=106"
"42","0.204030","192.168.150.119","192.168.150.19","TCP","60","48040  >  15417 [ACK] Seq=5237 Ack=107 Win=32715 Len=0"
"43","0.214244","Siemens_16:18:cf","Siemens_bd:bc:46","PNIO","60","RTC1, ID:0x8003, Len:  40, Cycle:20672 (Valid,Primary,Ok,Run)"
"44","0.224443","192.168.150.119","192.168.150.23","TCP","60","48040  >  4650 [ACK] Seq=5237 Ack=107 Win=32397 Len=0"
"45","0.224443","Siemens_23:ae:b5","Siemens_bd:bc:46","PNIO","60","RTC1, ID:0x8002, Len:  40, Cycle:  256 (Valid,Primary,Ok,Run)"
"46","0.254603","Siemens_bd:bc:46","SiemensNumer_35:d8:bc","PNIO","60","RTC1, ID:0x8000, Len:  40, Cycle:28672 (Valid,Primary,Ok,Run)"
"47","0.254634","Siemens_bd:bc:46","Siemens_23:ae:b5","PNIO","60","RTC1, ID:0x8000, Len:  40, Cycle:28928 (Valid,Primary,Ok,Run)"
"48","0.254677","Siemens_bd:bc:46","Siemens_16:18:cf","PNIO","60","RTC1, ID:0x8000, Len:  40, Cycle:29056 (Valid,Primary,Ok,Run)"
"49","0.254758","SiemensNumer_35:d8:bc","Siemens_bd:bc:46","PNIO","60","RTC1, ID:0x8001, Len:  40, Cycle:28672 (Valid,Primary,Ok,Run)"
"50","0.254862","192.168.150.119","192.168.150.19","TCP","1514","48040  >  15416 [ACK] Seq=5237 Ack=107 Win=32454 Len=1460"
"51","0.254986","192.168.150.119","192.168.150.19","TCP","1514","48040  >  15416 [ACK] Seq=6697 Ack=107 Win=32454 Len=1460"
"52","0.255090","192.168.150.119","192.168.150.19","TCP","1514","48040  >  15416 [ACK] Seq=8157 Ack=107 Win=32454 Len=1460"
"53","0.255090","192.168.150.19","192.168.150.119","TCP","60","15416  >  48040 [ACK] Seq=107 Ack=8157 Win=1026 Len=0"
"54","0.255182","192.168.150.119","192.168.150.19","TCP","910","48040  >  15416 [PSH, ACK] Seq=9617 Ack=107 Win=32454 Len=856"
"55","0.265329","192.168.150.119","192.168.150.19","TCP","1514","48040  >  15417 [ACK] Seq=5237 Ack=107 Win=32715 Len=1460"
"56","0.265480","192.168.150.119","192.168.150.19","TCP","1514","48040  >  15417 [ACK] Seq=6697 Ack=107 Win=32715 Len=1460"
"57","0.265480","192.168.150.119","192.168.150.23","TCP","143","48040  >  4649 [PSH, ACK] Seq=5237 Ack=107 Win=32715 Len=89"
"58","0.265543","192.168.150.119","192.168.150.19","TCP","1514","48040  >  15417 [ACK] Seq=8157 Ack=107 Win=32715 Len=1460"
"59","0.265593","192.168.150.19","192.168.150.119","TCP","60","15416  >  48040 [ACK] Seq=107 Ack=10473 Win=1026 Len=0"
"60","0.265606","Siemens_16:18:cf","Siemens_bd:bc:46","PNIO","60","RTC1, ID:0x8003, Len:  40, Cycle:24768 (Valid,Primary,Ok,Run)"
"61","0.265653","192.168.150.23","192.168.150.119","TCP","152","4649  >  48040 [PSH, ACK] Seq=107 Ack=5326 Win=1026 Len=98"
"62","0.265792","192.168.150.119","192.168.150.19","TCP","910","48040  >  15417 [PSH, ACK] Seq=9617 Ack=107 Win=32715 Len=856"
"63","0.265899","192.168.150.119","192.168.150.23","TCP","1514","48040  >  4650 [ACK] Seq=5237 Ack=107 Win=32397 Len=1460"
"64","0.265899","192.168.150.19","192.168.150.119","TCP","60","15417  >  48040 [ACK] Seq=107 Ack=8157 Win=1026 Len=0"
"65","0.266002","192.168.150.119","192.168.150.23","TCP","1514","48040  >  4650 [ACK] Seq=6697 Ack=107 Win=32397 Len=1460"
"66","0.276180","192.168.150.23","192.168.150.119","TCP","60","4650  >  48040 [ACK] Seq=107 Ack=8157 Win=1026 Len=0"
"67","0.276272","192.168.150.119","192.168.150.23","TCP","1514","48040  >  4650 [ACK] Seq=8157 Ack=107 Win=32397 Len=1460"
"68","0.276370","192.168.150.119","192.168.150.23","TCP","910","48040  >  4650 [PSH, ACK] Seq=9617 Ack=107 Win=32397 Len=856"
"69","0.276370","192.168.150.23","192.168.150.119","TCP","60","4650  >  48040 [ACK] Seq=107 Ack=10473 Win=1026 Len=0"
"70","0.276472","192.168.150.119","192.168.150.23","TCP","1514","48040  >  4649 [ACK] Seq=5326 Ack=107 Win=32715 Len=1460"
"71","0.276472","192.168.150.23","192.168.150.119","TCP","60","4649  >  48040 [ACK] Seq=205 Ack=6786 Win=1026 Len=0"
"72","0.276574","192.168.150.19","192.168.150.119","TCP","60","15417  >  48040 [ACK] Seq=107 Ack=10473 Win=1026 Len=0"
"73","0.276647","192.168.150.119","192.168.150.23","TCP","1514","48040  >  4649 [ACK] Seq=6786 Ack=107 Win=32715 Len=1460"
"74","0.276647","192.168.150.23","192.168.150.119","TCP","60","4649  >  48040 [ACK] Seq=205 Ack=8246 Win=1026 Len=0"
"75","0.276804","192.168.150.119","192.168.150.23","TCP","1514","48040  >  4649 [ACK] Seq=8246 Ack=107 Win=32715 Len=1460"
"76","0.276804","192.168.150.23","192.168.150.119","TCP","60","4649  >  48040 [ACK] Seq=205 Ack=9706 Win=1026 Len=0"
"77","0.276960","192.168.150.119","192.168.150.23","TCP","910","48040  >  4649 [PSH, ACK] Seq=9706 Ack=107 Win=32715 Len=856"
"78","0.276979","192.168.150.19","192.168.150.119","TCP","160","15417  >  48040 [PSH, ACK] Seq=107 Ack=10473 Win=1026 Len=106"
"79","0.307402","192.168.150.19","192.168.150.119","TCP","160","15416  >  48040 [PSH, ACK] Seq=107 Ack=10473 Win=1026 Len=106"
"80","0.307402","192.168.150.23","192.168.150.119","TCP","60","4649  >  48040 [ACK] Seq=205 Ack=10562 Win=1023 Len=0"
"81","0.327654","192.168.150.23","192.168.150.119","TCP","160","4649  >  48040 [PSH, ACK] Seq=205 Ack=10562 Win=1023 Len=106"
"82","0.327751","192.168.150.119","192.168.150.23","TCP","60","48040  >  4649 [ACK] Seq=10562 Ack=311 Win=32613 Len=0"
"83","0.337971","192.168.150.119","192.168.150.19","TCP","60","48040  >  15416 [ACK] Seq=10473 Ack=213 Win=32401 Len=0"
"84","0.347990","192.168.150.119","192.168.150.19","TCP","60","48040  >  15417 [ACK] Seq=10473 Ack=213 Win=32662 Len=0"
"85","0.348008","Siemens_23:ae:b5","Siemens_bd:bc:46","PNIO","60","RTC1, ID:0x8002, Len:  40, Cycle: 4352 (Valid,Primary,Ok,Run)"
"86","0.348080","Siemens_bd:bc:46","SiemensNumer_35:d8:bc","PNIO","60","RTC1, ID:0x8000, Len:  40, Cycle:32768 (Valid,Primary,Ok,Run)"
"87","0.358356","192.168.150.23","192.168.150.119","TCP","160","4650  >  48040 [PSH, ACK] Seq=107 Ack=10473 Win=1026 Len=106"
"88","0.388504","Siemens_bd:bc:46","Siemens_23:ae:b5","PNIO","60","RTC1, ID:0x8000, Len:  40, Cycle:33024 (Valid,Primary,Ok,Run)"
"89","0.388523","Siemens_bd:bc:46","Siemens_16:18:cf","PNIO","60","RTC1, ID:0x8000, Len:  40, Cycle:33152 (Valid,Primary,Ok,Run)"
"90","0.459274","SiemensNumer_35:d8:bc","Siemens_bd:bc:46","PNIO","60","RTC1, ID:0x8001, Len:  40, Cycle:32768 (Valid,Primary,Ok,Run)"
"91","0.469325","Siemens_16:18:cf","Siemens_bd:bc:46","PNIO","60","RTC1, ID:0x8003, Len:  40, Cycle:28864 (Valid,Primary,Ok,Run)"
"92","0.469325","192.168.150.119","192.168.150.23","TCP","60","48040  >  4650 [ACK] Seq=10473 Ack=213 Win=32344 Len=0"
"93","0.469349","Siemens_23:ae:b5","Siemens_bd:bc:46","PNIO","60","RTC1, ID:0x8002, Len:  40, Cycle: 8448 (Valid,Primary,Ok,Run)"
"94","0.469442","192.168.150.119","192.168.150.19","TCP","1514","48040  >  15416 [ACK] Seq=10473 Ack=213 Win=32401 Len=1460"
"95","0.479592","Siemens_bd:bc:46","SiemensNumer_35:d8:bc","PNIO","60","RTC1, ID:0x8000, Len:  40, Cycle:36864 (Valid,Primary,Ok,Run)"
"96","0.479695","192.168.150.119","192.168.150.19","TCP","1514","48040  >  15416 [ACK] Seq=11933 Ack=213 Win=32401 Len=1460"
"97","0.479785","192.168.150.119","192.168.150.19","TCP","1514","48040  >  15416 [ACK] Seq=13393 Ack=213 Win=32401 Len=1460"
"98","0.479785","192.168.150.19","192.168.150.119","TCP","60","15416  >  48040 [ACK] Seq=213 Ack=13393 Win=1026 Len=0"
"99","0.479888","192.168.150.119","192.168.150.19","TCP","910","48040  >  15416 [PSH, ACK] Seq=14853 Ack=213 Win=32401 Len=856"
"100","0.479990","192.168.150.119","192.168.150.19","TCP","1514","48040  >  15417 [ACK] Seq=10473 Ack=213 Win=32662 Len=1460"
"101","0.480093","192.168.150.119","192.168.150.19","TCP","1514","48040  >  15417 [ACK] Seq=11933 Ack=213 Win=32662 Len=1460"
"102","0.480117","192.168.150.119","192.168.150.19","TCP","1514","48040  >  15417 [ACK] Seq=13393 Ack=213 Win=32662 Len=1460"
"103","0.480195","192.168.150.19","192.168.150.119","TCP","60","15416  >  48040 [ACK] Seq=213 Ack=15709 Win=1026 Len=0"
"104","0.480214","192.168.150.119","192.168.150.19","TCP","910","48040  >  15417 [PSH, ACK] Seq=14853 Ack=213 Win=32662 Len=856"
"105","0.490429","192.168.150.119","192.168.150.23","TCP","1514","48040  >  4649 [ACK] Seq=10562 Ack=311 Win=32613 Len=1460"
"106","0.490529","192.168.150.119","192.168.150.23","TCP","1514","48040  >  4649 [ACK] Seq=12022 Ack=311 Win=32613 Len=1460"
"107","0.490529","192.168.150.23","192.168.150.119","TCP","60","4649  >  48040 [ACK] Seq=311 Ack=13482 Win=1026 Len=0"
"108","0.490579","192.168.150.19","192.168.150.119","TCP","60","15417  >  48040 [ACK] Seq=213 Ack=13393 Win=1026 Len=0"
"109","0.490658","192.168.150.119","192.168.150.23","TCP","1514","48040  >  4649 [ACK] Seq=13482 Ack=311 Win=32613 Len=1460"
"110","0.490760","192.168.150.119","192.168.150.23","TCP","910","48040  >  4649 [PSH, ACK] Seq=14942 Ack=311 Win=32613 Len=856"
"111","0.490760","192.168.150.23","192.168.150.119","TCP","60","4649  >  48040 [ACK] Seq=311 Ack=15798 Win=1026 Len=0"
"112","0.490811","192.168.150.119","192.168.150.23","TCP","143","48040  >  4650 [PSH, ACK] Seq=10473 Ack=213 Win=32344 Len=89"
"113","0.490913","192.168.150.119","192.168.150.23","TCP","1514","48040  >  4650 [ACK] Seq=10562 Ack=213 Win=32344 Len=1460"
"114","0.490964","192.168.150.23","192.168.150.119","TCP","60","4650  >  48040 [ACK] Seq=213 Ack=12022 Win=1026 Len=0"
"115","0.490964","192.168.150.19","192.168.150.119","TCP","60","15417  >  48040 [ACK] Seq=213 Ack=15709 Win=1026 Len=0"
"116","0.491069","192.168.150.119","192.168.150.23","TCP","1514","48040  >  4650 [ACK] Seq=12022 Ack=213 Win=32344 Len=1460"
"117","0.491175","192.168.150.119","192.168.150.23","TCP","1514","48040  >  4650 [ACK] Seq=13482 Ack=213 Win=32344 Len=1460"
"118","0.491175","192.168.150.23","192.168.150.119","TCP","60","4650  >  48040 [ACK] Seq=213 Ack=14942 Win=1026 Len=0"
"119","0.491225","192.168.150.19","192.168.150.119","TCP","160","15417  >  48040 [PSH, ACK] Seq=213 Ack=15709 Win=1026 Len=106"
"120","0.491410","192.168.150.19","192.168.150.119","TCP","160","15416  >  48040 [PSH, ACK] Seq=213 Ack=15709 Win=1026 Len=106"
"121","0.491481","192.168.150.119","192.168.150.23","TCP","910","48040  >  4650 [PSH, ACK] Seq=14942 Ack=213 Win=32344 Len=856"
"122","0.521743","Siemens_bd:bc:46","Siemens_23:ae:b5","PNIO","60","RTC1, ID:0x8000, Len:  40, Cycle:37120 (Valid,Primary,Ok,Run)"
"123","0.531878","Siemens_bd:bc:46","Siemens_16:18:cf","PNIO","60","RTC1, ID:0x8000, Len:  40, Cycle:37248 (Valid,Primary,Ok,Run)"
"124","0.542007","SiemensNumer_35:d8:bc","Siemens_bd:bc:46","PNIO","60","RTC1, ID:0x8001, Len:  40, Cycle:36864 (Valid,Primary,Ok,Run)"
"125","0.552166","Siemens_16:18:cf","Siemens_bd:bc:46","PNIO","60","RTC1, ID:0x8003, Len:  40, Cycle:32960 (Valid,Primary,Ok,Run)"
"126","0.552185","192.168.150.23","192.168.150.119","TCP","60","4650  >  48040 [ACK] Seq=213 Ack=15798 Win=1023 Len=0"
"127","0.552262","192.168.150.23","192.168.150.119","TCP","160","4649  >  48040 [PSH, ACK] Seq=311 Ack=15798 Win=1026 Len=106"
"128","0.562599","192.168.150.119","192.168.150.19","TCP","60","48040  >  15416 [ACK] Seq=15709 Ack=319 Win=32348 Len=0"
"129","0.562599","192.168.150.119","192.168.150.19","TCP","60","48040  >  15417 [ACK] Seq=15709 Ack=319 Win=32609 Len=0"
"130","0.562599","SiemensNumer_35:d8:bd","LLDP_Multicast","LLDP","289","LA/sinamics-v90 LA/port-001 20 SysD=Siemens, SINAMICS, V90 PN, 6SL3 210-5FB10-4UF1 , HW: Version 1, FW: Version V01.03.00, SZVJ5Y0R005645   RTClass3 Port Status = OFF"
"131","0.562599","192.168.150.23","192.168.150.119","TCP","160","4650  >  48040 [PSH, ACK] Seq=213 Ack=15798 Win=1023 Len=106"
"132","0.582984","192.168.150.23","192.168.150.119","TCP","152","4650  >  48040 [PSH, ACK] Seq=319 Ack=15798 Win=1023 Len=98"
"133","0.603009","192.168.150.119","192.168.150.23","TCP","60","48040  >  4650 [ACK] Seq=15798 Ack=417 Win=32242 Len=0"
"134","0.603030","Siemens_23:ae:b5","Siemens_bd:bc:46","PNIO","60","RTC1, ID:0x8002, Len:  40, Cycle:12544 (Valid,Primary,Ok,Run)"
"135","0.613331","192.168.150.119","192.168.150.23","TCP","60","48040  >  4649 [ACK] Seq=15798 Ack=417 Win=32560 Len=0"
"136","0.623303","Siemens_bd:bc:46","SiemensNumer_35:d8:bc","PNIO","60","RTC1, ID:0x8000, Len:  40, Cycle:40960 (Valid,Primary,Ok,Run)"
"137","0.623383","Siemens_bd:bc:46","Siemens_23:ae:b5","PNIO","60","RTC1, ID:0x8000, Len:  40, Cycle:41216 (Valid,Primary,Ok,Run)"
"138","0.633525","Siemens_bd:bc:46","Siemens_16:18:cf","PNIO","60","RTC1, ID:0x8000, Len:  40, Cycle:41344 (Valid,Primary,Ok,Run)"
"139","0.643733","MoxaTechnolo_09:ed:fc","Broadcast","ARP","60","Who has 157.158.57.35? Tell 157.158.57.69"
"140","0.694370","MoxaTechnolo_09:ed:fc","Broadcast","RARP","60","Who is 00:01:05:1b:9f:95? Tell 00:90:e8:09:ed:fc"
"141","0.694370","SiemensNumer_35:d8:bc","Siemens_bd:bc:46","PNIO","60","RTC1, ID:0x8001, Len:  40, Cycle:40960 (Valid,Primary,Ok,Run)"
"142","0.694370","Siemens_16:18:cf","Siemens_bd:bc:46","PNIO","60","RTC1, ID:0x8003, Len:  40, Cycle:37056 (Valid,Primary,Ok,Run)"
"143","0.694370","192.168.150.119","192.168.150.19","TCP","1514","48040  >  15416 [ACK] Seq=15709 Ack=319 Win=32348 Len=1460"
"144","0.694370","192.168.150.119","192.168.150.19","TCP","1514","48040  >  15416 [ACK] Seq=17169 Ack=319 Win=32348 Len=1460"
"145","0.694480","192.168.150.119","192.168.150.19","TCP","1514","48040  >  15416 [ACK] Seq=18629 Ack=319 Win=32348 Len=1460"
"146","0.694480","192.168.150.19","192.168.150.119","TCP","60","15416  >  48040 [ACK] Seq=319 Ack=18629 Win=1026 Len=0"
"147","0.694593","192.168.150.119","192.168.150.19","TCP","910","48040  >  15416 [PSH, ACK] Seq=20089 Ack=319 Win=32348 Len=856"
"148","0.694683","192.168.150.119","192.168.150.19","TCP","1514","48040  >  15417 [ACK] Seq=15709 Ack=319 Win=32609 Len=1460"
"149","0.704873","192.168.150.119","192.168.150.19","TCP","1514","48040  >  15417 [ACK] Seq=17169 Ack=319 Win=32609 Len=1460"
"150","0.704974","192.168.150.119","192.168.150.19","TCP","1514","48040  >  15417 [ACK] Seq=18629 Ack=319 Win=32609 Len=1460"
"151","0.704974","192.168.150.19","192.168.150.119","TCP","60","15416  >  48040 [ACK] Seq=319 Ack=20945 Win=1026 Len=0"
"152","0.705048","192.168.150.119","192.168.150.19","TCP","910","48040  >  15417 [PSH, ACK] Seq=20089 Ack=319 Win=32609 Len=856"
"153","0.705157","192.168.150.119","192.168.150.23","TCP","1514","48040  >  4649 [ACK] Seq=15798 Ack=417 Win=32560 Len=1460"
"154","0.705273","192.168.150.119","192.168.150.23","TCP","1514","48040  >  4649 [ACK] Seq=17258 Ack=417 Win=32560 Len=1460"
"155","0.705273","192.168.150.23","192.168.150.119","TCP","60","4649  >  48040 [ACK] Seq=417 Ack=18718 Win=1026 Len=0"
"156","0.705313","192.168.150.19","192.168.150.119","TCP","60","15417  >  48040 [ACK] Seq=319 Ack=18629 Win=1026 Len=0"
"157","0.705392","192.168.150.119","192.168.150.23","TCP","1514","48040  >  4649 [ACK] Seq=18718 Ack=417 Win=32560 Len=1460"
"158","0.705501","192.168.150.119","192.168.150.23","TCP","906","48040  >  4649 [PSH, ACK] Seq=20178 Ack=417 Win=32560 Len=852"
"159","0.715655","192.168.150.23","192.168.150.119","TCP","60","4649  >  48040 [ACK] Seq=417 Ack=21030 Win=1026 Len=0"
"160","0.715726","192.168.150.119","192.168.150.23","TCP","1514","48040  >  4650 [ACK] Seq=15798 Ack=417 Win=32242 Len=1460"
"161","0.715726","192.168.150.19","192.168.150.119","TCP","60","15417  >  48040 [ACK] Seq=319 Ack=20945 Win=1026 Len=0"
"162","0.715879","192.168.150.119","192.168.150.23","TCP","1514","48040  >  4650 [ACK] Seq=17258 Ack=417 Win=32242 Len=1460"
"163","0.715879","192.168.150.23","192.168.150.119","TCP","60","4650  >  48040 [ACK] Seq=417 Ack=18718 Win=1026 Len=0"
"164","0.715981","192.168.150.119","192.168.150.23","TCP","1514","48040  >  4650 [ACK] Seq=18718 Ack=417 Win=32242 Len=1460"
"165","0.715981","Siemens_23:ae:b5","Siemens_bd:bc:46","PNIO","60","RTC1, ID:0x8002, Len:  40, Cycle:16640 (Valid,Primary,Ok,Run)"
"166","0.726173","192.168.150.19","192.168.150.119","TCP","160","15416  >  48040 [PSH, ACK] Seq=319 Ack=20945 Win=1026 Len=106"
"167","0.726173","192.168.150.19","192.168.150.119","TCP","160","15417  >  48040 [PSH, ACK] Seq=319 Ack=20945 Win=1026 Len=106"
"168","0.726272","192.168.150.119","192.168.150.23","TCP","910","48040  >  4650 [PSH, ACK] Seq=20178 Ack=417 Win=32242 Len=856"
"169","0.736406","192.168.150.23","192.168.150.119","TCP","60","4650  >  48040 [ACK] Seq=417 Ack=21034 Win=1026 Len=0"
"170","0.756593","Siemens_bd:bc:46","SiemensNumer_35:d8:bc","PNIO","60","RTC1, ID:0x8000, Len:  40, Cycle:45056 (Valid,Primary,Ok,Run)"
"171","0.766712","Siemens_bd:bc:46","Siemens_23:ae:b5","PNIO","60","RTC1, ID:0x8000, Len:  40, Cycle:45312 (Valid,Primary,Ok,Run)"
"172","0.766730","Siemens_bd:bc:46","Siemens_16:18:cf","PNIO","60","RTC1, ID:0x8000, Len:  40, Cycle:45440 (Valid,Primary,Ok,Run)"
"173","0.766779","192.168.150.23","192.168.150.119","TCP","160","4649  >  48040 [PSH, ACK] Seq=417 Ack=21030 Win=1026 Len=106"
"174","0.777012","SiemensNumer_35:d8:bc","Siemens_bd:bc:46","PNIO","60","RTC1, ID:0x8001, Len:  40, Cycle:45056 (Valid,Primary,Ok,Run)"
"175","0.777012","192.168.150.119","192.168.150.19","TCP","60","48040  >  15416 [ACK] Seq=20945 Ack=425 Win=32295 Len=0"
"176","0.797324","192.168.150.119","192.168.150.19","TCP","60","48040  >  15417 [ACK] Seq=20945 Ack=425 Win=32556 Len=0"
"177","0.797324","Siemens_16:18:cf","Siemens_bd:bc:46","PNIO","60","RTC1, ID:0x8003, Len:  40, Cycle:41152 (Valid,Primary,Ok,Run)"
"178","0.827635","192.168.150.23","192.168.150.119","TCP","160","4650  >  48040 [PSH, ACK] Seq=417 Ack=21034 Win=1026 Len=106"
"179","0.858187","192.168.150.119","192.168.150.23","TCP","60","48040  >  4649 [ACK] Seq=21030 Ack=523 Win=32507 Len=0"
"180","0.858187","192.168.150.119","192.168.150.23","TCP","60","48040  >  4650 [ACK] Seq=21034 Ack=523 Win=32189 Len=0"
"181","0.867981","Siemens_23:ae:b5","Siemens_bd:bc:46","PNIO","60","RTC1, ID:0x8002, Len:  40, Cycle:20736 (Valid,Primary,Ok,Run)"
"182","0.888473","Siemens_bd:bc:46","SiemensNumer_35:d8:bc","PNIO","60","RTC1, ID:0x8000, Len:  40, Cycle:49152 (Valid,Primary,Ok,Run)"
"183","0.898608","Siemens_bd:bc:46","Siemens_23:ae:b5","PNIO","60","RTC1, ID:0x8000, Len:  40, Cycle:49408 (Valid,Primary,Ok,Run)"
"184","0.908637","Siemens_bd:bc:46","Siemens_16:18:cf","PNIO","60","RTC1, ID:0x8000, Len:  40, Cycle:49536 (Valid,Primary,Ok,Run)"
"185","0.908637","SiemensNumer_35:d8:bc","Siemens_bd:bc:46","PNIO","60","RTC1, ID:0x8001, Len:  40, Cycle:49152 (Valid,Primary,Ok,Run)"
"186","0.908658","Siemens_16:18:cf","Siemens_bd:bc:46","PNIO","60","RTC1, ID:0x8003, Len:  40, Cycle:45248 (Valid,Primary,Ok,Run)"
"187","0.908788","192.168.150.119","192.168.150.19","TCP","1514","48040  >  15416 [ACK] Seq=20945 Ack=425 Win=32295 Len=1460"
"188","0.908893","192.168.150.119","192.168.150.19","TCP","1514","48040  >  15416 [ACK] Seq=22405 Ack=425 Win=32295 Len=1460"
"189","0.909001","192.168.150.119","192.168.150.19","TCP","1514","48040  >  15416 [ACK] Seq=23865 Ack=425 Win=32295 Len=1460"
"190","0.919123","192.168.150.19","192.168.150.119","TCP","60","15416  >  48040 [ACK] Seq=425 Ack=23865 Win=1026 Len=0"
"191","0.919123","192.168.150.119","192.168.150.19","TCP","910","48040  >  15416 [PSH, ACK] Seq=25325 Ack=425 Win=32295 Len=856"
"192","0.919275","192.168.150.119","192.168.150.19","TCP","1514","48040  >  15417 [ACK] Seq=20945 Ack=425 Win=32556 Len=1460"
"193","0.919379","192.168.150.119","192.168.150.19","TCP","1514","48040  >  15417 [ACK] Seq=22405 Ack=425 Win=32556 Len=1460"
"194","0.919379","192.168.150.19","192.168.150.119","TCP","60","15416  >  48040 [ACK] Seq=425 Ack=26181 Win=1026 Len=0"
"195","0.919478","192.168.150.119","192.168.150.19","TCP","1514","48040  >  15417 [ACK] Seq=23865 Ack=425 Win=32556 Len=1460"
"196","0.919490","192.168.150.119","192.168.150.19","TCP","910","48040  >  15417 [PSH, ACK] Seq=25325 Ack=425 Win=32556 Len=856"
"197","0.919596","192.168.150.119","192.168.150.23","TCP","1514","48040  >  4649 [ACK] Seq=21030 Ack=523 Win=32507 Len=1460"
"198","0.919697","192.168.150.119","192.168.150.23","TCP","1514","48040  >  4649 [ACK] Seq=22490 Ack=523 Win=32507 Len=1460"
"199","0.929816","192.168.150.19","192.168.150.119","TCP","60","15417  >  48040 [ACK] Seq=425 Ack=23865 Win=1026 Len=0"
"200","0.929816","192.168.150.23","192.168.150.119","TCP","60","4649  >  48040 [ACK] Seq=523 Ack=23950 Win=1026 Len=0"
"201","0.929915","192.168.150.119","192.168.150.23","TCP","1514","48040  >  4649 [ACK] Seq=23950 Ack=523 Win=32507 Len=1460"
"202","0.930044","192.168.150.119","192.168.150.23","TCP","1514","48040  >  4649 [ACK] Seq=25410 Ack=523 Win=32507 Len=1460"
"203","0.930171","192.168.150.119","192.168.150.23","TCP","1514","48040  >  4649 [ACK] Seq=26870 Ack=523 Win=32507 Len=1460"
"204","0.930171","192.168.150.119","192.168.150.23","TCP","200","48040  >  4649 [PSH, ACK] Seq=28330 Ack=523 Win=32507 Len=146"
"205","0.930171","192.168.150.19","192.168.150.119","TCP","60","15417  >  48040 [ACK] Seq=425 Ack=26181 Win=1026 Len=0"
"206","0.930326","192.168.150.119","192.168.150.23","TCP","1514","48040  >  4650 [ACK] Seq=21034 Ack=523 Win=32189 Len=1460"
"207","0.930426","192.168.150.119","192.168.150.23","TCP","1514","48040  >  4650 [ACK] Seq=22494 Ack=523 Win=32189 Len=1460"
"208","0.930426","192.168.150.23","192.168.150.119","TCP","60","4649  >  48040 [ACK] Seq=523 Ack=28476 Win=1026 Len=0"
"209","0.930426","192.168.150.23","192.168.150.119","TCP","60","4650  >  48040 [ACK] Seq=523 Ack=23954 Win=1026 Len=0"
"210","0.930529","192.168.150.19","192.168.150.119","TCP","160","15417  >  48040 [PSH, ACK] Seq=425 Ack=26181 Win=1026 Len=106"
"211","0.930529","192.168.150.19","192.168.150.119","TCP","160","15416  >  48040 [PSH, ACK] Seq=425 Ack=26181 Win=1026 Len=106"
"212","0.930672","192.168.150.119","192.168.150.23","TCP","1514","48040  >  4650 [ACK] Seq=23954 Ack=523 Win=32189 Len=1460"
"213","0.940819","192.168.150.119","192.168.150.23","TCP","1514","48040  >  4650 [ACK] Seq=25414 Ack=523 Win=32189 Len=1460"
"214","0.960994","192.168.150.23","192.168.150.119","TCP","60","4650  >  48040 [ACK] Seq=523 Ack=26874 Win=1026 Len=0"
"215","0.961094","192.168.150.119","192.168.150.23","TCP","1514","48040  >  4650 [ACK] Seq=26874 Ack=523 Win=32189 Len=1460"
"216","0.961195","192.168.150.119","192.168.150.23","TCP","1514","48040  >  4650 [ACK] Seq=28334 Ack=523 Win=32189 Len=1460"
"217","0.961195","192.168.150.23","192.168.150.119","TCP","60","4650  >  48040 [ACK] Seq=523 Ack=29794 Win=1026 Len=0"
"218","0.961347","192.168.150.119","192.168.150.23","TCP","1514","48040  >  4650 [ACK] Seq=29794 Ack=523 Win=32189 Len=1460"
"219","0.971425","192.168.150.119","192.168.150.23","TCP","196","48040  >  4650 [PSH, ACK] Seq=31254 Ack=523 Win=32189 Len=142"
"220","0.981576","192.168.150.23","192.168.150.119","TCP","60","4650  >  48040 [ACK] Seq=523 Ack=31396 Win=1026 Len=0"
"221","0.981576","Cisco_08:e3:7c","PVST+","STP","64","RST. Root = 61440/227/58:ac:78:a1:38:c1  Cost = 1  Port = 0x9000"
"222","0.981605","Siemens_23:ae:b5","Siemens_bd:bc:46","PNIO","60","RTC1, ID:0x8002, Len:  40, Cycle:24832 (Valid,Primary,Ok,Run)"
"223","0.991910","Siemens_bd:bc:46","SiemensNumer_35:d8:bc","PNIO","60","RTC1, ID:0x8000, Len:  40, Cycle:53248 (Valid,Primary,Ok,Run)"
"224","0.991910","192.168.150.119","192.168.150.19","TCP","60","48040  >  15417 [ACK] Seq=26181 Ack=531 Win=32503 Len=0"
"225","0.991910","192.168.150.23","192.168.150.119","TCP","160","4649  >  48040 [PSH, ACK] Seq=523 Ack=28476 Win=1026 Len=106"
"226","1.012313","Siemens_bd:bc:46","Siemens_23:ae:b5","PNIO","60","RTC1, ID:0x8000, Len:  40, Cycle:53504 (Valid,Primary,Ok,Run)"
"227","1.012313","Siemens_bd:bc:46","Siemens_16:18:cf","PNIO","60","RTC1, ID:0x8000, Len:  40, Cycle:53632 (Valid,Primary,Ok,Run)"
"228","1.022613","192.168.150.23","192.168.150.119","TCP","160","4650  >  48040 [PSH, ACK] Seq=523 Ack=31396 Win=1026 Len=106"
"229","1.022613","192.168.150.119","192.168.150.19","TCP","60","48040  >  15416 [ACK] Seq=26181 Ack=531 Win=32242 Len=0"
"230","1.022758","192.168.150.119","192.168.150.19","TCP","1514","48040  >  15416 [ACK] Seq=26181 Ack=531 Win=32242 Len=1460"
"231","1.022758","SiemensNumer_35:d8:bc","Siemens_bd:bc:46","PNIO","60","RTC1, ID:0x8001, Len:  40, Cycle:53248 (Valid,Primary,Ok,Run)"
"232","1.022903","192.168.150.119","192.168.150.19","TCP","1514","48040  >  15416 [ACK] Seq=27641 Ack=531 Win=32242 Len=1460"
"233","1.023049","192.168.150.119","192.168.150.19","TCP","1514","48040  >  15416 [ACK] Seq=29101 Ack=531 Win=32242 Len=1460"
"234","1.023049","192.168.150.19","192.168.150.119","TCP","60","15416  >  48040 [ACK] Seq=531 Ack=29101 Win=1026 Len=0"
"235","1.023152","192.168.150.119","192.168.150.19","TCP","910","48040  >  15416 [PSH, ACK] Seq=30561 Ack=531 Win=32242 Len=856"
"236","1.023308","192.168.150.119","192.168.150.19","TCP","1514","48040  >  15417 [ACK] Seq=26181 Ack=531 Win=32503 Len=1460"
"237","1.023487","192.168.150.119","192.168.150.19","TCP","1514","48040  >  15417 [ACK] Seq=27641 Ack=531 Win=32503 Len=1460"
"238","1.023586","192.168.150.119","192.168.150.19","TCP","1514","48040  >  15417 [ACK] Seq=29101 Ack=531 Win=32503 Len=1460"
"239","1.033749","192.168.150.19","192.168.150.119","TCP","60","15416  >  48040 [ACK] Seq=531 Ack=31417 Win=1026 Len=0"
"240","1.033778","192.168.150.119","192.168.150.19","TCP","910","48040  >  15417 [PSH, ACK] Seq=30561 Ack=531 Win=32503 Len=856"
"241","1.033933","192.168.150.119","192.168.150.23","TCP","1514","48040  >  4649 [ACK] Seq=28476 Ack=629 Win=32454 Len=1460"
"242","1.033933","Siemens_16:18:cf","Siemens_bd:bc:46","PNIO","60","RTC1, ID:0x8003, Len:  40, Cycle:49344 (Valid,Primary,Ok,Run)"
"243","1.034038","192.168.150.119","192.168.150.23","TCP","1514","48040  >  4649 [ACK] Seq=29936 Ack=629 Win=32454 Len=1460"
"244","1.034038","192.168.150.119","192.168.150.23","TCP","160","48040  >  4649 [PSH, ACK] Seq=31396 Ack=629 Win=32454 Len=106"
"245","1.054294","192.168.150.23","192.168.150.119","TCP","60","4649  >  48040 [ACK] Seq=629 Ack=31396 Win=1026 Len=0"
"246","1.054294","192.168.150.19","192.168.150.119","TCP","60","15417  >  48040 [ACK] Seq=531 Ack=29101 Win=1026 Len=0"
"247","1.054332","192.168.150.19","192.168.150.119","TCP","60","15417  >  48040 [ACK] Seq=531 Ack=31417 Win=1026 Len=0"
"248","1.064522","192.168.150.19","192.168.150.119","TCP","160","15417  >  48040 [PSH, ACK] Seq=531 Ack=31417 Win=1026 Len=106"
"249","1.074674","192.168.150.19","192.168.150.119","TCP","160","15416  >  48040 [PSH, ACK] Seq=531 Ack=31417 Win=1026 Len=106"
"250","1.094870","192.168.150.119","192.168.150.23","TCP","60","48040  >  4650 [ACK] Seq=31396 Ack=629 Win=32136 Len=0"
"251","1.094895","192.168.150.23","192.168.150.119","TCP","60","4649  >  48040 [ACK] Seq=629 Ack=31502 Win=1026 Len=0"
"252","1.115275","192.168.150.23","192.168.150.119","TCP","160","4649  >  48040 [PSH, ACK] Seq=629 Ack=31502 Win=1026 Len=106"
"253","1.115275","Siemens_23:ae:b5","Siemens_bd:bc:46","PNIO","60","RTC1, ID:0x8002, Len:  40, Cycle:28928 (Valid,Primary,Ok,Run)"
"254","1.115275","192.168.150.119","192.168.150.19","TCP","60","48040  >  15416 [ACK] Seq=31417 Ack=637 Win=32189 Len=0"
"255","1.125560","192.168.150.119","192.168.150.19","TCP","60","48040  >  15417 [ACK] Seq=31417 Ack=637 Win=32450 Len=0"
"256","1.125560","Siemens_bd:bc:46","SiemensNumer_35:d8:bc","PNIO","60","RTC1, ID:0x8000, Len:  40, Cycle:57344 (Valid,Primary,Ok,Run)"
"257","1.145640","Siemens_bd:bc:46","Siemens_23:ae:b5","PNIO","60","RTC1, ID:0x8000, Len:  40, Cycle:57600 (Valid,Primary,Ok,Run)"
"258","1.145674","Siemens_bd:bc:46","Siemens_16:18:cf","PNIO","60","RTC1, ID:0x8000, Len:  40, Cycle:57728 (Valid,Primary,Ok,Run)"
"259","1.155865","MoxaTechnolo_09:ed:fc","Broadcast","RARP","60","Who is 00:01:05:3e:d7:f0? Tell 00:90:e8:09:ed:fc"
"260","1.226778","192.168.150.119","192.168.150.23","TCP","60","48040  >  4649 [ACK] Seq=31502 Ack=735 Win=32401 Len=0"
"261","1.236655","SiemensNumer_35:d8:bc","Siemens_bd:bc:46","PNIO","60","RTC1, ID:0x8001, Len:  40, Cycle:57344 (Valid,Primary,Ok,Run)"
"262","1.236674","Siemens_16:18:cf","Siemens_bd:bc:46","PNIO","60","RTC1, ID:0x8003, Len:  40, Cycle:53440 (Valid,Primary,Ok,Run)"
"263","1.236750","Siemens_23:ae:b5","Siemens_bd:bc:46","PNIO","60","RTC1, ID:0x8002, Len:  40, Cycle:33024 (Valid,Primary,Ok,Run)"
"264","1.236979","192.168.150.119","192.168.150.19","TCP","1514","48040  >  15416 [ACK] Seq=31417 Ack=637 Win=32189 Len=1460"
"265","1.237020","192.168.150.119","192.168.150.19","TCP","1514","48040  >  15416 [ACK] Seq=32877 Ack=637 Win=32189 Len=1460"
"266","1.237147","192.168.150.119","192.168.150.19","TCP","1514","48040  >  15416 [ACK] Seq=34337 Ack=637 Win=32189 Len=1460"
"267","1.247238","192.168.150.19","192.168.150.119","TCP","60","15416  >  48040 [ACK] Seq=637 Ack=34337 Win=1026 Len=0"
"268","1.247276","192.168.150.119","192.168.150.19","TCP","910","48040  >  15416 [PSH, ACK] Seq=35797 Ack=637 Win=32189 Len=856"
"269","1.247394","192.168.150.119","192.168.150.19","TCP","1514","48040  >  15417 [ACK] Seq=31417 Ack=637 Win=32450 Len=1460"
"270","1.247489","192.168.150.119","192.168.150.19","TCP","1514","48040  >  15417 [ACK] Seq=32877 Ack=637 Win=32450 Len=1460"
"271","1.247619","192.168.150.119","192.168.150.19","TCP","1514","48040  >  15417 [ACK] Seq=34337 Ack=637 Win=32450 Len=1460"
"272","1.247619","192.168.150.19","192.168.150.119","TCP","60","15416  >  48040 [ACK] Seq=637 Ack=36653 Win=1026 Len=0"
"273","1.247693","192.168.150.119","192.168.150.19","TCP","910","48040  >  15417 [PSH, ACK] Seq=35797 Ack=637 Win=32450 Len=856"
"274","1.247784","192.168.150.19","192.168.150.119","TCP","160","15416  >  48040 [PSH, ACK] Seq=637 Ack=36653 Win=1026 Len=106"
"275","1.247877","192.168.150.119","192.168.150.23","TCP","1514","48040  >  4649 [ACK] Seq=31502 Ack=735 Win=32401 Len=1460"
"276","1.247977","192.168.150.119","192.168.150.23","TCP","1514","48040  >  4649 [ACK] Seq=32962 Ack=735 Win=32401 Len=1460"
"277","1.258078","192.168.150.23","192.168.150.119","TCP","60","4649  >  48040 [ACK] Seq=735 Ack=34422 Win=1026 Len=0"
"278","1.258078","192.168.150.19","192.168.150.119","TCP","60","15417  >  48040 [ACK] Seq=637 Ack=34337 Win=1026 Len=0"
"279","1.258206","192.168.150.119","192.168.150.23","TCP","1514","48040  >  4649 [ACK] Seq=34422 Ack=735 Win=32401 Len=1460"
"280","1.258296","192.168.150.119","192.168.150.23","TCP","910","48040  >  4649 [PSH, ACK] Seq=35882 Ack=735 Win=32401 Len=856"
"281","1.258296","192.168.150.23","192.168.150.119","TCP","60","4649  >  48040 [ACK] Seq=735 Ack=36738 Win=1026 Len=0"
"282","1.258446","192.168.150.119","192.168.150.23","TCP","1514","48040  >  4650 [ACK] Seq=31396 Ack=629 Win=32136 Len=1460"
"283","1.258549","192.168.150.119","192.168.150.23","TCP","1514","48040  >  4650 [ACK] Seq=32856 Ack=629 Win=32136 Len=1460"
"284","1.258549","192.168.150.19","192.168.150.119","TCP","60","15417  >  48040 [ACK] Seq=637 Ack=36653 Win=1026 Len=0"
"285","1.258549","192.168.150.23","192.168.150.119","TCP","60","4650  >  48040 [ACK] Seq=629 Ack=34316 Win=1026 Len=0"
"286","1.258705","192.168.150.119","192.168.150.23","TCP","1514","48040  >  4650 [ACK] Seq=34316 Ack=629 Win=32136 Len=1460"
"287","1.258723","192.168.150.119","192.168.150.23","TCP","906","48040  >  4650 [PSH, ACK] Seq=35776 Ack=629 Win=32136 Len=852"
"288","1.258807","192.168.150.23","192.168.150.119","TCP","60","4650  >  48040 [ACK] Seq=629 Ack=36628 Win=1026 Len=0"
"289","1.279011","Siemens_bd:bc:46","SiemensNumer_35:d8:bc","PNIO","60","RTC1, ID:0x8000, Len:  40, Cycle:61440 (Valid,Primary,Ok,Run)"
"290","1.279024","Siemens_bd:bc:46","Siemens_23:ae:b5","PNIO","60","RTC1, ID:0x8000, Len:  40, Cycle:61696 (Valid,Primary,Ok,Run)"
"291","1.279110","Siemens_bd:bc:46","Siemens_16:18:cf","PNIO","60","RTC1, ID:0x8000, Len:  40, Cycle:61824 (Valid,Primary,Ok,Run)"
"292","1.279110","192.168.150.135","224.0.0.9","IGMPv2","60","Membership Report group 224.0.0.9"
"293","1.279161","SiemensNumer_35:d8:bc","Siemens_bd:bc:46","PNIO","60","RTC1, ID:0x8001, Len:  40, Cycle:61440 (Valid,Primary,Ok,Run)"
"294","1.289296","192.168.150.19","192.168.150.119","TCP","160","15417  >  48040 [PSH, ACK] Seq=637 Ack=36653 Win=1026 Len=106"
"295","1.299463","192.168.150.23","192.168.150.119","TCP","160","4649  >  48040 [PSH, ACK] Seq=735 Ack=36738 Win=1026 Len=106"
"296","1.333642","Siemens_16:18:cf","Siemens_bd:bc:46","PNIO","60","RTC1, ID:0x8003, Len:  40, Cycle:57536 (Valid,Primary,Ok,Run)"
"297","1.333642","192.168.150.119","192.168.150.19","TCP","60","48040  >  15416 [ACK] Seq=36653 Ack=743 Win=32136 Len=0"
"298","1.333685","192.168.150.23","192.168.150.119","TCP","160","4650  >  48040 [PSH, ACK] Seq=629 Ack=36628 Win=1026 Len=106"
"299","1.364032","192.168.150.119","192.168.150.23","TCP","60","48040  >  4649 [ACK] Seq=36738 Ack=841 Win=32348 Len=0"
"300","1.374123","192.168.150.119","192.168.150.19","TCP","60","48040  >  15417 [ACK] Seq=36653 Ack=743 Win=32397 Len=0"
"301","1.374164","Siemens_23:ae:b5","Siemens_bd:bc:46","PNIO","60","RTC1, ID:0x8002, Len:  40, Cycle:37120 (Valid,Primary,Ok,Run)"
"302","1.374210","Siemens_bd:bc:46","SiemensNumer_35:d8:bc","PNIO","60","RTC1, ID:0x8000, Len:  40, Cycle:    0 (Valid,Primary,Ok,Run)"
"303","1.404552","Siemens_bd:bc:46","Siemens_23:ae:b5","PNIO","60","RTC1, ID:0x8000, Len:  40, Cycle:  256 (Valid,Primary,Ok,Run)"
"304","1.415046","192.168.150.119","192.168.150.23","TCP","60","48040  >  4650 [ACK] Seq=36628 Ack=735 Win=32083 Len=0"
"305","1.455059","Siemens_bd:bc:46","Siemens_16:18:cf","PNIO","60","RTC1, ID:0x8000, Len:  40, Cycle:  384 (Valid,Primary,Ok,Run)"
"306","1.455077","SiemensNumer_35:d8:bc","Siemens_bd:bc:46","PNIO","60","RTC1, ID:0x8001, Len:  40, Cycle:    0 (Valid,Primary,Ok,Run)"
"307","1.455118","Siemens_16:18:cf","Siemens_bd:bc:46","PNIO","60","RTC1, ID:0x8003, Len:  40, Cycle:61632 (Valid,Primary,Ok,Run)"
"308","1.455259","192.168.150.119","192.168.150.19","TCP","1514","48040  >  15416 [ACK] Seq=36653 Ack=743 Win=32136 Len=1460"
"309","1.455396","192.168.150.119","192.168.150.19","TCP","1514","48040  >  15416 [ACK] Seq=38113 Ack=743 Win=32136 Len=1460"
"310","1.455499","192.168.150.119","192.168.150.19","TCP","1514","48040  >  15416 [ACK] Seq=39573 Ack=743 Win=32136 Len=1460"
"311","1.465595","192.168.150.19","192.168.150.119","TCP","60","15416  >  48040 [ACK] Seq=743 Ack=39573 Win=1026 Len=0"
"312","1.465816","192.168.150.119","192.168.150.19","TCP","910","48040  >  15416 [PSH, ACK] Seq=41033 Ack=743 Win=32136 Len=856"
"313","1.465927","192.168.150.119","192.168.150.19","TCP","1514","48040  >  15417 [ACK] Seq=36653 Ack=743 Win=32397 Len=1460"
"314","1.465977","192.168.150.119","192.168.150.19","TCP","1514","48040  >  15417 [ACK] Seq=38113 Ack=743 Win=32397 Len=1460"
"315","1.466080","192.168.150.119","192.168.150.19","TCP","1514","48040  >  15417 [ACK] Seq=39573 Ack=743 Win=32397 Len=1460"
